{
  "schema_version": 1,
  "vault_id": "vault-example-001",
  "scope_id": "scope-example-project",
  "record_id": "record-example-memory",
  "kind": "memory",
  "revision_id": "revision-example-delete",
  "parents": ["revision-example-base"],
  "operation_id": "operation-example-delete",
  "operation": "delete",
  "author_device_id": "device-example-c",
  "created_at": "2026-10-02T09:01:00Z",
  "provenance": {
    "source_kind": "manual",
    "source_ref": "fixture:offline-conflict/concurrent-delete"
  },
  "tags": ["synthetic", "sync-policy"]
}
