{
  "schema_version": 1,
  "vault_id": "vault-example-001",
  "scope_id": "scope-example-project",
  "record_id": "record-example-memory",
  "kind": "memory",
  "revision_id": "revision-example-edit-a",
  "parents": ["revision-example-base"],
  "operation_id": "operation-example-edit-a",
  "operation": "put",
  "author_device_id": "device-example-a",
  "created_at": "2026-10-02T09:00:00Z",
  "provenance": {
    "source_kind": "harness",
    "source_ref": "fixture:offline-conflict/edit-a",
    "harness": "synthetic-harness-a"
  },
  "tags": ["synthetic", "sync-policy"],
  "payload": {
    "text": "Synthetic example: prefer a two-minute reconciliation interval on mains power."
  }
}
